{
  "topic": "Trainium3 isn't a chip launch—it's hyperscalers funding the shadow ASIC supply chain",
  "summary_structured": {
    "thesis": "Amazon's Trainium3 reveal signals a structural break: hyperscalers are moving off general-purpose GPUs toward purpose-built ASIC stacks, and the largest, most durable value will accrue to specialist supply-chain partners—the 'shadow winners'—who provide design/IP, interconnect, power/thermal and advanced-packaging/foundry services.",
    "why_now": "Inference growth, improved compiler/portability, mounting TCO pressure from general-purpose GPUs ('Nvidia tax'), and announced hyperscaler capex programs (e.g., Project Rainier and Trainium scale-outs) make large ASIC deployments economically and temporally feasible over 2025–26.",
    "key_mechanism": [
      "High TCO on general-purpose GPUs motivates hyperscalers to substitute bespoke ASICs for repetitive inference workloads, lowering per-workload costs.",
      "Hyperscalers delegate specialist functions—IP blocks, physical design, SerDes/CXL retimers, optics, PMICs, and cooling—to external vendors, creating per-server supplier content growth.",
      "Large-scale programs (Project Rainier) mechanically convert hyperscaler server counts into recurring wafer, packaging, interconnect and power-equipment revenue for suppliers.",
      "Advanced-packaging and foundry scarcity (CoWoS/2.5D, TSMC node capacity) create chokepoints that concentrate value among a few providers."
    ],
    "key_catalysts": [
      "Amazon Trainium3 reveal and broader hyperscaler ASIC program announcements",
      "Project Rainier and Trainium scale-out deployment timelines",
      "2025–26 hyperscaler capex cycles and inference workload growth lowering ASIC switching barriers"
    ],
    "beneficiary_groups": [
      {
        "sector": "ASIC Design & IP",
        "reason": "Provide the essential IP, physical design and turnkey services that scale hyperscaler ASICs and capture content/NRE per chip.",
        "companies": ["Broadcom", "Marvell Technology", "Alchip Technologies"]
      },
      {
        "sector": "Connectivity & Interconnect",
        "reason": "Retimers, CXL controllers, AEC and optics are required as ASIC servers densify—creating persistent per-rack content growth.",
        "companies": ["Astera Labs", "Credo Technology", "Coherent"]
      },
      {
        "sector": "Power & Thermal",
        "reason": "PMICs, 48V architectures and liquid-cooling infrastructure are structural demand pools as chip power density rises.",
        "companies": ["Monolithic Power Systems", "Vicor", "Vertiv Holdings"]
      },
      {
        "sector": "Manufacturing & Advanced Packaging",
        "reason": "Foundry and advanced-packaging capacity is a chokepoint for high-end ASICs, translating hyperscaler volume into wafer and packaging revenue.",
        "companies": ["TSMC", "Amkor Technology", "Ibiden"]
      }
    ],
    "scenario_summary": null,
    "case_study": {
      "name": "Project Rainier",
      "meaning": "AWS's Trainium scale-out exemplifies how a hyperscaler program converts server add-ins into predictable supplier revenue: Alchip (turnkey physicalization), Astera/Credo (retimers/AEC), TSMC/packagers (wafer & CoWoS demand), and MPS/Vicor/Vertiv (power and cooling) all see mechanically linked content growth."
    },
    "table_candidates_summary": [],
    "investor_implication": "Rotate exposure away from a single-accelerator focus toward suppliers with direct, contractual or technological linkage to hyperscaler ASIC deployments; prioritize firms with clear content-per-server economics, indispensability (IP/SerDes/packaging) or chokepoint supply (TSMC/CoWoS).",
    "risks": [
      "Client-concentration: some beneficiaries have high revenue exposure to a single hyperscaler, creating execution and renewal risk.",
      "Geopolitical/supply-chain risk: Taiwan-centric foundry and substrate exposure raises geopolitical vulnerability.",
      "Dual-sourcing & competition: hyperscalers can cap pricing power via dual-sourcing or substituting vendors.",
      "Packaging/foundry bottlenecks: constrained advanced-packaging or node capacity can delay revenue realization or reallocate share.",
      "Technology-adoption timing: CXL, silicon photonics and ecosystem standards may take longer to mature, slowing derivative supplier growth."
    ]
  },
  "key_takeaways": [
    "Trainium3 is a signal—not just a chip launch—that hyperscalers are pursuing structural independence from general-purpose GPUs to lower TCO.",
    "Value is migrating off the accelerator frontline to a repeatable set of 'shadow winners'—design/IP houses, interconnect firms, power/thermal vendors and advanced-packagers/foundries.",
    "Project Rainier shows mechanical, recurring revenue: each additional ASIC server produces predictable wafer, packaging, interconnect and power-equipment demand.",
    "Advanced-packaging and foundry scarcity (CoWoS/2.5D, TSMC capacity) concentrate pricing power and make certain suppliers strategic chokepoints.",
    "Investor action: favor suppliers with direct hyperscaler linkage, indispensable technology/IP or supply-side scarcity rather than only accelerator incumbents."
  ],
  "summary_short": "Trainium3 marks a deeper structural pivot: hyperscalers are moving from general-purpose GPUs to bespoke ASIC stacks to escape the Nvidia tax, especially for inference-heavy workloads. The durable winners are not the frontline chip brands but specialist suppliers—design/IP firms, interconnect and optics vendors, power/thermal specialists and advanced-packagers/foundries—whose content-per-server roles convert hyperscaler capex into recurring revenue. Investors should rotate toward these supply-chain beneficiaries and prioritize direct linkage, technological indispensability and capacity scarcity."
}
